{"audit_packet_sha256":"f5a61c2155f85bdb7608d0baaaaaf019c88e81aec6f81ccf597023ffefe5ce06","passed":true,"summary":"The browser-deletion claim is faithfully supported for the explicitly bounded source, SQLite dataset, successful operations, and sequential reference workload. The evidence exercises Selenium against the real delete button, fetches the real DELETE endpoint, commits through SQLite, reloads through the real list endpoint, and compares the resulting DOM rows with a read-only SQL projection. Ten measured delete HTTP samples, twenty feedback samples, nineteen render samples, and passing deletion projection cases all satisfy the declared deadlines. The result does not establish behavior under concurrency, failures, arbitrary datasets, or compositor paint latency.","claim_reasoning":"The implementation connects each promised boundary. static/app.js attaches a delete listener to every rendered row, sets pending feedback, sends DELETE /api/items/{id}, reports completion only after a successful response, and calls loadRows. app.py parses the identifier, executes parameterized DELETE FROM items WHERE id = ?, commits when the sqlite context exits, returns the acknowledged identifier, and list_items subsequently queries the same database with deterministic sorting and pagination. certify.py exercises five browser deletions, waits for a new DOM load version, and computes expected rows from SQL after each deletion. The deletion checker reports matching membership and order hashes for delete-00 through delete-04. The timing analysis reports ten delete HTTP samples with observed maximum 9.2362 ms against 50 ms, feedback maximum 0.1 ms against 16 ms, and render maximum 0.4 ms against 16 ms. These facts entail the narrow stated promise under its assumptions.","rule0_assessment":"No queue, queue limit, timeout, retry, debounce, rejection path, fake delete fast path, or mocked database operation is introduced to satisfy certification. The browser action crosses fetch and the actual HTTP server; the server executes a real parameterized SQLite DELETE and the following list request reads the committed database. The projection comparison uses Selenium-observed rows and an application SQL projection rather than a synthetic timing loop. A meaningful scope limitation remains: ThreadingHTTPServer permits concurrent handlers even though the evidence records observed concurrency one, and the harness only tests successful sequential operations on a small seeded dataset. Those limitations are consistent with the claim's explicit assumption and should not be converted into user-facing restrictions merely to simplify proof.","reviewed_files":[".dagcertignore","README.md","__init__.py","app.py","certify.py","static/app.js","static/index.html","static/style.css"],"strengths":[{"subject":"Real deletion path","evidence":"app.js sends DELETE /api/items/${identifier}; app.py executes parameterized DELETE FROM items WHERE id = ? inside sqlite3.connect and returns the committed identifier after the context closes.","impact":"The evidence represents the actual browser-to-HTTP-to-SQLite operation promised, reducing the risk that certification measured a stand-in."},{"subject":"Post-delete projection validation","evidence":"certify.py waits for data-load-version to advance after each delete, then captures Selenium DOM rows and computes expected_projection from the same SQLite database with deterministic ORDER BY and LIMIT/OFFSET; all five deletion cases have matching expected and observed hashes.","impact":"A deleted record's resulting sorted page membership and order are checked at the user-visible DOM boundary."},{"subject":"Deadline evidence","evidence":"The supplied analysis reports 10 items.delete HTTP samples, 20 ui.feedback samples, and 19 ui.render samples; each certified upper bound remains below its declared 50 ms or 16 ms limit.","impact":"The sequential reference workload has sufficient measured samples for the named deletion and feedback/render timing obligations."}],"weaknesses":[{"subject":"Concurrency semantics","evidence":"ApplicationServer is a ThreadingHTTPServer, while the contract declares worker concurrency 1 and the timing samples only record observed_worker_concurrency 1 from sequential requests.","impact":"Concurrent deletes or list/delete races are not characterized; users under simultaneous activity could observe stale projections or SQLite contention outside the certified scope."},{"subject":"Failure and retry behavior","evidence":"removeItem reports failure and clears the pending marker for non-OK responses or fetch exceptions, but the claim and browser exercise cover only successful deletions and do not test an unavailable server, malformed response, or competing deletion.","impact":"The certificate does not establish recovery, idempotency, or state consistency after partial failures."},{"subject":"Visible timing interpretation","evidence":"recordTiming measures elapsed time around textContent/dataset changes and renderRows DOM construction; it does not measure compositor paint or end-to-end click-to-paint latency.","impact":"The 16 ms result is a DOM-mutation/render-script bound, not a guarantee of pixels being painted within 16 ms on every display or machine."}],"improvements":[{"priority":"high","subject":"Concurrent delete consistency","recommendation":"Add explicit concurrency tests for simultaneous deletes, delete-versus-list races, and repeated deletion of the same identifier, while documenting the intended serialization or snapshot semantics.","rationale":"The current sequential evidence is valid for its stated scope, but production users can generate overlapping requests; testing this would reveal stale-page or contention behavior without imposing an arbitrary queue limit."},{"priority":"medium","subject":"Failure-path browser tests","recommendation":"Exercise non-OK DELETE responses, network interruption after server commit, and a missing record, then verify pending-row cleanup, user feedback, and subsequent reload state.","rationale":"The UI has distinct failure branches, but they are unverified; covering them would improve user trust and detect divergence between client state and committed SQLite state."},{"priority":"low","subject":"Clarify timing boundary","recommendation":"Rename or document the visible timing metric as DOM-mutation latency, or add a separate paint-aware measurement if the product promise is intended to cover actual visual presentation.","rationale":"The current implementation and README support DOM timing, while the word visible can be read more broadly; explicit terminology prevents users from overinterpreting the 16 ms result."}],"test_fitting_risks":[{"subject":"Small synthetic workload","evidence":"The browser exercise deletes five newly inserted Zulu browser rows from a small seeded registry, and HTTP timing samples use short fixed payloads and page sizes of three.","impact":"The checks can miss performance or correctness problems caused by larger tables, long strings, unusual identifiers, or deletion of records on other pages."},{"subject":"Harness-derived wait condition","evidence":"certify.py waits for body data-load-version increments, a counter set by renderRows, rather than independently waiting for the deleted row to disappear or for a database acknowledgment observed outside the app's own event logic.","impact":"A regression that increments the counter while rendering an incorrect page could be caught by projection hashes in these cases, but timing and state-transition coverage remain coupled to application instrumentation."}],"evidence_gaps":[{"subject":"Dataset and deployment breadth","evidence":"The packet explicitly limits the guarantee to the exercised SQLite dataset and sequential reference workload; only the supplied seeded and temporary timing/browser rows are exercised.","impact":"No evidence supports arbitrary production-sized datasets, persistent deployment conditions, multiple browser instances, or concurrent users."},{"subject":"Committed-state independence","evidence":"The post-delete expected projection is read from SQLite and the endpoint returns the deleted identifier, but there is no independent transaction-log or second connection assertion specifically proving durability beyond normal sqlite context commit semantics.","impact":"The supplied source makes the commit path credible, yet durability under abrupt process or storage failure is outside the evidence."}],"findings":[]}
