{
  "audit_packet_sha256": "0bbd12900b6f59611b0901e8a930bafff7e81a5e38ea1db40d9d65e8ace6922c",
  "passed": true,
  "summary": "The claim is faithfully supported for the explicitly bounded certified source, exercised SQLite database, and sequential reference workload. The browse checker reports matching expected and observed DOM projections, including stable row-key and ordering hashes for initial, sorted, and next/previous-page cases. The HTTP evidence crosses the real ThreadingHTTPServer, SQLite query, and JSON response path, while browser evidence comes from Selenium against the real application. Recorded maxima remain below the declared 50 ms list deadline and 16 ms DOM-mutation deadline. The result does not establish compositor paint, end-to-end network-to-paint latency, concurrent behavior, or arbitrary datasets, but those limits are stated assumptions rather than hidden omissions.",
  "claim_reasoning": "The implementation maps the promised path directly: app.py validates page and sort parameters, executes parameterized LIMIT/OFFSET SQLite queries with deterministic secondary id ordering, and returns the selected rows; static/app.js fetches that endpoint and renderRows replaces the real table body with the returned records. certify.py drives Selenium through initial load, direction changes, category and created sorting, next-page, and previous-page transitions, waiting for a load-version change before observing rows. The browse projection result contains nine passing cases with equal expected and observed counts and hashes, including all named pagination and sorting cases. The timing analysis reports 12 real list HTTP samples with a 12.44 ms maximum and 19 render samples with a 0.40 ms maximum, both under their declared limits after the stated safety factor. These facts entail the narrow claim under its exact-source, exercised-dataset, sequential-workload, and DOM-mutation assumptions.",
  "rule0_assessment": "The supplied source does not introduce an arbitrary application queue, queue limit, rate limiter, retry, debounce, timeout, cancellation path, or fake fast path to satisfy this claim. The HTTP measurements are recorded around urllib requests to the live local server, and the browser checks use Selenium against the real served HTML and JavaScript; the SQL expected projection and DOM observation are compared by stable semantic keys and visible fields. The application remains a genuine SQLite-backed list implementation. The main Rule 0 limitation is scope rather than product degradation: only seven seeded rows and sequential interactions are exercised, and the browser timing intentionally stops at DOM mutation. That is expressly disclosed and prevents overclaiming paint or concurrency behavior.",
  "reviewed_files": [".dagcertignore","__init__.py","app.py","certify.py","README.md","static/app.js","static/index.html","static/style.css"],
  "strengths": [
    {"subject":"Real database and HTTP projection path","evidence":"app.py opens SQLite for each list request, executes SELECT id,title,category with validated sort columns, deterministic id tie-breaking, LIMIT and OFFSET, and serializes the result through ApplicationHandler._json; timing metadata identifies the boundary as HTTP+SQLite+JSON.","impact":"The evidence measures the promised backend operation rather than a timed stand-in, so the selected records and ordering are tied to actual database and HTTP behavior."},
    {"subject":"Real browser rendering verification","evidence":"certify.py opens a Selenium browser, navigates to the served base URL, clicks the real sort and pagination controls, waits for data-load-version changes, and compares observed [data-item-row] elements and visible title/category fields against read-only SQL projections.","impact":"The browser portion of the claim is directly exercised across the actual UI state transitions, reducing the risk that a backend-only check masks a rendering defect."},
    {"subject":"Exact ordering and membership checks","evidence":"The browse checker passes initial-title-ascending, title-descending, next-page, previous-page, category-asc/desc, and created-asc/desc cases, with equal expected and observed counts, content hashes, and order hashes for every case.","impact":"Both row membership and order are checked for the claim's named browse scenarios, including deterministic tie behavior."},
    {"subject":"Deadline evidence meets declared thresholds","evidence":"Contract analysis reports 12 list HTTP samples with observed maximum 12.4358 ms and certified upper bound 16.1665 ms against 50 ms, plus 19 UI-render samples with observed maximum 0.4 ms and certified upper bound 0.52 ms against 16 ms.","impact":"The measured sequential reference workload has substantial margin under both declared deadlines."}
  ],
  "weaknesses": [
    {"subject":"Concurrent or out-of-order browser loads","evidence":"static/app.js updates shared state and calls loadRows without aborting or sequencing overlapping fetches; a slower earlier request could render after a newer request if users interact rapidly. The audit assumption and evidence cover only sequential interactions.","impact":"Rapid real-user sorting or pagination could display stale rows even though the sequential claim passes; this is outside the certified promise but is a meaningful product correctness risk."},
    {"subject":"Dataset and workload narrowness","evidence":"The certificate README and claim assumption limit the guarantee to the exercised SQLite dataset and sequential reference workload; the collected browse cases use page size three and a small seeded database.","impact":"The result says little about large tables, long titles, duplicate sort values at scale, empty or partial pages, database contention, or concurrent users."},
    {"subject":"Timing metric is intentionally partial","evidence":"static/app.js records ui.render from before replaceChildren and DOM construction until the synchronous mutation completes, while the explicit assumption says the UI timing is DOM mutation rather than compositor paint or total network-to-paint latency.","impact":"A user may experience slower visual presentation than the measured 16 ms figure under rendering, layout, paint, network, or browser scheduling costs."}
  ],
  "improvements": [
    {"priority":"high","subject":"Prevent stale asynchronous renders","recommendation":"Add request sequencing or AbortController cancellation so only the latest list request may update the table and load-version state.","rationale":"This preserves correct user-visible ordering during rapid sort and pagination actions without imposing an arbitrary queue or reducing normal application behavior."},
    {"priority":"medium","subject":"Broaden projection coverage","recommendation":"Add realistic cases for empty pages, partial final pages, duplicate titles/categories, larger datasets, and boundary page values while keeping the same real HTTP and Selenium path.","rationale":"These cases would test the SQL tie-breaker, has_next/has_previous state, and rendering behavior where pagination bugs are more likely, improving confidence beyond the seven-row fixture."},
    {"priority":"medium","subject":"Measure end-to-end visual latency separately","recommendation":"Retain the DOM-mutation metric but add an explicitly labeled browser paint or user-observable completion metric if a broader responsiveness promise is desired.","rationale":"This would align timing evidence with what users see while preserving the current narrow claim and avoiding conflation of DOM work with compositor or network latency."}
  ],
  "test_fitting_risks": [
    {"subject":"Small fixed fixture","evidence":"collect initializes a reset database with seven SEED_ITEMS, uses page_size three, and the browse checker observes only three rows per case.","impact":"The implementation could still have scale, empty-page, or boundary defects that cannot appear in this fixed workload; the claim remains valid only because it explicitly limits the dataset."},
    {"subject":"Timing instrumentation measures a very small synchronous region","evidence":"recordTiming wraps status text assignment or renderRows DOM construction, and recorded UI values are mostly 0.0 to 0.4 ms.","impact":"These values are not evidence for full request-to-visible-paint latency, although the prompt's explicit assumption correctly narrows the English promise."}
  ],
  "evidence_gaps": [
    {"subject":"No stress or concurrency evidence","evidence":"All timing samples declare observed_worker_concurrency 1, and certify.py issues requests and browser actions sequentially.","impact":"The claim cannot be generalized to concurrent HTTP requests, simultaneous browser actions, SQLite locking, or scheduler contention."},
    {"subject":"No compositor-paint or network-to-paint measurement","evidence":"The timing evidence boundary is real browser DOM and the claim explicitly assumes DOM mutation rather than compositor paint or total network-to-paint latency.","impact":"Visual smoothness and end-to-end responsiveness remain unverified beyond the stated DOM deadline."}
  ],
  "findings": []
}
