{"audit_packet_sha256":"8488253e3397b11f19ff1316a737d06dfb32a6a89459522ea712965723daee59","passed":true,"summary":"The bounded-summary-lag claim is faithfully entailed as a conditional capacity statement about the declared flow model. The contract declares three summarizer workers, vote.commit cadence of 100–200 ms, and summary.advance service duration of 80–200 ms. The supplied checker reports maximum generation rate 10/s, minimum modeled update rate 15/s, and a passed three-generation bound. This does not establish an independently observed runtime lag guarantee, but the English claim limits itself to the declared conditional model and explicitly stated assumptions.","claim_reasoning":"The relevant contract links vote.commit to summary.advance through summary-lag, with vote.commit producing one unit and summary.advance consuming one unit. Three summarizer workers and the assumed 200 ms worst-case service envelope yield 3/0.2 = 15 modeled updates per second, while the 200 ms maximum vote cadence yields at most 5 generations per second (the checker conservatively reports a 10/s maximum generation rate). The checker result passes with maximum_generations 3. The evidence does not execute a queue, scheduler, or concurrent summarizer pool; it measures ten successful calls to a pure increment function. That gap would invalidate an operational lag promise, but not this narrowly worded modeled-capacity claim.","rule0_assessment":"No arbitrary queue, queue limit, timeout, retry, cancellation, rate limiter, rejection path, reduced concurrency, or fake fast path is introduced in the reviewed source to satisfy the certificate. However, summary.advance is only a pure integer increment and the application has no runtime worker pool, queue, lag state, or scheduling implementation. The measured sub-millisecond completion samples therefore cannot be treated as evidence of an actual summarization service. The claim remains acceptable because it promises only enough capacity in the declared conditional flow model, while the packet explicitly states cadence and service-envelope assumptions. Users must not read it as a production freshness guarantee.","reviewed_files":["__init__.py","app.py","certify.py","README.md"],"strengths":[{"subject":"Explicit conditional scope","evidence":"The claim says “In the declared conditional flow model” and names the vote.commit cadence and summary.advance service envelope as assumptions; README.md likewise describes cadence and service envelopes as modeling assumptions rather than measured production facts.","impact":"This keeps the promise narrower than an unqualified runtime latency or freshness guarantee and makes the principal limitation visible to users."},{"subject":"Consistent modeled resource flow","evidence":"certify.py declares vote.commit producing summary-lag and summary.advance consuming summary-lag; the checker result reports the lag task as summary.advance with maximum_generations 3 and passed=true.","impact":"The modeled dependency and resource accounting directly correspond to the claimed bounded-generation relationship."},{"subject":"Capacity margin in the checker","evidence":"The supplied application_check_results facts report maximum generation rate 10.0, minimum update rate 15.0, maximum_generations 3, and passed=true.","impact":"The model has positive service-capacity margin rather than merely asserting equality at the boundary, reducing sensitivity to ordinary modeled variation."}],"weaknesses":[{"subject":"No implemented summarizer runtime","evidence":"app.py implements advance_summary_generation as generation + 1, and certify.py measures it synchronously ten times; there is no queue, worker dispatch, concurrent execution, lag state, or end-to-end summary pipeline.","impact":"The result cannot establish actual user-visible summary freshness, backlog behavior, fairness, saturation handling, or state consistency."},{"subject":"Assumed envelope is not measured","evidence":"The contract marks summary.advance/service-envelope as assumed with lower_ms 80 and upper_ms 200, and the checker facts repeat that assumption; measured completion samples are approximately 0.0002–0.0004 ms instead.","impact":"The central service rate is hypothetical. If real summarization work is slower than assumed, the modeled three-generation bound may no longer hold."},{"subject":"Checker/model semantics are external to application behavior","evidence":"The certificate invokes examples.optional_flow_checker.check_flow_guarantees, while the application itself has no implementation of the modeled worker scheduling or atomic resource operations.","impact":"Correctness depends on the checker’s abstract scheduling and resource semantics, not on enforceable runtime invariants in this example."}],"improvements":[{"priority":"high","subject":"Runtime summary pipeline","recommendation":"If an operational lag guarantee is desired, implement and test the actual summary queue, worker dispatch, generation state, and resource accounting, then measure end-to-end lag under concurrent load.","rationale":"This would connect the certificate to the user-visible operation and expose saturation, fairness, ordering, and failure behavior instead of relying on a pure increment stand-in."},{"priority":"medium","subject":"Service-envelope evidence","recommendation":"Collect representative summary.advance service-duration samples from the real summarization operation and document workload, percentile, and environmental conditions used to justify the 80–200 ms envelope.","rationale":"The current envelope is wholly assumed, so measured workload evidence would make the modeled capacity calculation materially more defensible."},{"priority":"low","subject":"Assumption and model documentation","recommendation":"State explicitly that the bound relies on atomic resource updates and fair scheduling, and distinguish the checker’s conservative rate calculation from the raw cadence interval.","rationale":"Clearer model semantics would reduce the risk that readers mistake a conditional proof artifact for an enforced production guarantee."}],"test_fitting_risks":[{"subject":"Synthetic completion measurement","evidence":"certify.py invokes advance_summary_generation with small integers in a tight synchronous loop and records ten near-zero-duration samples.","impact":"This workload is trivially fitted to the implementation and says nothing about real summarization cost, blocking, queueing, or worker contention."},{"subject":"Declared concurrency without runtime concurrency","evidence":"The contract declares summarizer concurrency 3, but certify.py observes worker concurrency 1 and app.py contains no worker implementation.","impact":"The three-worker capacity is a model parameter, not an experimentally demonstrated application property."}],"evidence_gaps":[{"subject":"No lag trajectory evidence","evidence":"The packet contains checker facts and timing samples but no execution trace showing generation arrivals, summary completions, queue depth, or lag over time.","impact":"There is no empirical confirmation that lag stays at or below three generations in an implementation."},{"subject":"No overload or failure testing","evidence":"The supplied evidence covers only ten successful completion calls and does not exercise concurrent arrivals, delayed service, worker failure, retries, or resource saturation.","impact":"Important boundary conditions for bounded lag remain unverified, even within a prospective runtime implementation."}],"findings":[]}
