{"audit_packet_sha256":"84edb509fd6fdc4e2ca9213f29cbc3a5445cb74601d12e2b56de1a90285c365b","passed":true,"summary":"The claim is faithfully entailed for its deliberately narrow scope. The supplied source measures the exact preview_vote_total and commit_vote_total functions from app.py ten times each, records successful completion samples, and applies the declared 16 ms and 50 ms upper bounds. The statement explicitly limits itself to this measured in-process workload and disclaims browser, network, and persistence behavior, so no broader operational promise is being inferred.","claim_reasoning":"certify.py invokes preview_vote_total(sample_index, 1) and commit_vote_total(sample_index, 1) directly, wraps each invocation with perf_counter(), and records ten completion samples per task with the exact source fingerprint. The supplied analysis reports certified upper bounds of 0.001950014848 ms for preview and 0.000910006929 ms for commit, both below their respective limits. app.py contains the actual functions and their shared _add implementation; there is no alternate fast path in the measured path. Because the English claim is explicitly restricted to this exact in-process workload, the evidence entails it even though it does not generalize to other inputs or environments.","rule0_assessment":"No queue, queue limit, timeout, cancellation, retry, debounce, serialization, rejection path, reduced concurrency, resource cap, or fake asynchronous fast path is introduced in the reviewed implementation to satisfy this responsiveness check. preview_vote_total and commit_vote_total perform the promised pure integer addition, and certify.py measures those functions directly rather than a timing stand-in. The main Rule 0 limitation is scope: the workload uses only ten small integer cases and does not exercise contention, invalid inputs, large integers, or surrounding application boundaries. Those are valid product-quality concerns but do not invalidate this narrowly worded claim.","reviewed_files":["__init__.py","app.py","certify.py","README.md"],"strengths":[{"subject":"Direct operation measurement","evidence":"certify.py assigns the actual imported preview_vote_total and commit_vote_total callables to the measured workload and times each invocation with perf_counter() around the call.","impact":"The evidence corresponds to the exact in-process functions named by the claim, avoiding substitution with a synthetic helper or unreachable code."},{"subject":"Traceable evidence binding","evidence":"Each TimingSample records task identity, worker, input and output types, success, observed concurrency, and the source fingerprint; the packet also supplies matching source and evidence hashes.","impact":"The result is auditable and reduces the risk that timings came from a different source revision or operation."},{"subject":"Narrow, honest promise","evidence":"The English requirement states the exact workload and explicitly says there is no browser, network, or persistence promise; README.md repeats that boundary.","impact":"Users are less likely to mistake a microbenchmark result for an end-to-end latency guarantee."}],"weaknesses":[{"subject":"Very narrow input coverage","evidence":"The measurement loop runs exactly ten cases, always using sample_index as current and 1 as delta, with values 0 through 9.","impact":"The claim does not characterize other valid integer magnitudes, negative deltas, or input distributions, so performance outside this workload remains unknown."},{"subject":"Measurement sensitivity","evidence":"The measured operations are pure Python integer addition and the reported timings are approximately 0.0002 to 0.0015 ms, far below the thresholds.","impact":"Interpreter noise, timer resolution, CPU scheduling, and runtime warm-up can dominate these values; the evidence is useful for the stated benchmark but weak as a robust production latency characterization."},{"subject":"No concurrent-path evidence","evidence":"The recorder reports observed_worker_concurrency 1 and the loop executes calls serially; app.py exposes no stateful contention path because both functions are pure.","impact":"The claim says nothing about latency under concurrent callers or application load, which may matter if these functions are later embedded in a shared service."}],"improvements":[{"priority":"medium","subject":"Workload representativeness","recommendation":"Expand the measured exact-source workload with documented representative positive, negative, zero, and larger integer operands while retaining the current ten-sample minimum.","rationale":"This would improve confidence that the narrow in-process promise covers normal input variation without adding artificial product restrictions."},{"priority":"low","subject":"Benchmark reproducibility","recommendation":"Record interpreter version, platform, warm-up policy, timer resolution, and repeated-run summary statistics alongside the existing samples.","rationale":"The sub-millisecond results are sensitive to environment and measurement overhead; metadata would make the evidence easier to interpret and reproduce."},{"priority":"low","subject":"Concurrency characterization","recommendation":"If concurrent use is part of the real product context, add a separate explicitly scoped benchmark under representative concurrency rather than extending this claim implicitly.","rationale":"A distinct workload and claim would expose contention behavior while preserving the current honest boundary."}],"test_fitting_risks":[{"subject":"Fixed trivial arguments","evidence":"certify.py always calls both functions with sample_index and delta 1, producing a minimal integer-addition path.","impact":"The certificate could be read too broadly if future implementations add input-dependent work that these fixed cases do not trigger; the current English wording prevents that overclaim but reviewers should preserve it."},{"subject":"Microbenchmark-only evidence","evidence":"The measured functions are pure one-line arithmetic wrappers and all ten samples complete in roughly microseconds, with no surrounding request, validation, or persistence boundary.","impact":"This is not evidence for an HTTP, browser, database, or end-to-end user-visible response, although those boundaries are expressly excluded from the claim."}],"evidence_gaps":[{"subject":"Input-domain breadth","evidence":"No samples cover negative deltas, large integers, invalid types, or any workload beyond current values 0 through 9 and delta 1.","impact":"Performance and error-path behavior for those cases are unverified and must not be inferred from this certificate."},{"subject":"Environmental robustness","evidence":"The packet provides one serial run of ten samples per operation and no cross-process, repeated-run, or load-test evidence.","impact":"Results may vary across machines, Python versions, or contention levels; the claim should remain tied to the supplied exact-source measurement."}],"findings":[]}
