{"audit_packet_sha256":"7f2a93eacce51712c24c16ff1fbe35652d556a624cdead55ca2a65d876198550","passed":true,"summary":"The claim is supported for the narrowly stated scope. certify.py directly invokes each exact function imported from app.py ten times, records successful non-None results with matching task, worker, input, output, and resource metadata, and the supplied structural checker reports no blocked task. The conclusion remains conditional on the explicitly stated resource-effect, atomic-acquisition, fairness, cadence, and service-model assumptions; it is not evidence of a production scheduler or runtime resource implementation.","claim_reasoning":"The four declared tasks map directly to preview_vote_total, commit_vote_total, advance_summary_generation, and render_vote_snapshot in app.py. certify.py performs ten iterations per task and rejects a None result, while the supplied evidence contains ten successful completion records for each task with the expected worker and type metadata. The flow-guarantees result reports structural_progress.passed true and claims that the declared DAG has no structurally blocked task. This entails the claim's completion and model-level structural statements, but only under the packet's explicit assumptions about declared resource effects, atomic acquisition, fair scheduling, and the timing assumptions used by the model.","rule0_assessment":"No arbitrary queue, timeout, retry, rejection path, concurrency reduction, resource cap, fake fast path, or product restriction is introduced in the supplied implementation. The measured operations are the actual app.py functions, not a timing stand-in, although they are extremely small pure in-process functions. The user-experience risk is therefore not an artificial slowdown but overinterpretation: the certificate does not demonstrate HTTP, browser, persistence, external-model, or real scheduler behavior. The declared resource effects are modeled in the contract and evidence rather than implemented by app.py, so the promise must remain conditional exactly as stated.","reviewed_files":["__init__.py","app.py","certify.py","README.md"],"strengths":[{"subject":"Exact task invocation","evidence":"certify.py imports all four operations from app.py and invokes the selected operation directly inside the ten-sample loop for each declared task.","impact":"The completion evidence corresponds to the supplied implementations rather than a synthetic helper, supporting the claim's exact in-process scope."},{"subject":"Per-task sample coverage","evidence":"The loop ranges over sample_index in range(10) for every entry in measured, and the supplied evidence and analysis report ten samples for vote.preview, vote.commit, summary.advance, and snapshot.render.","impact":"Every declared task has the required completion sample count, with no omitted task in the claim's primitive references."},{"subject":"Structural checker result","evidence":"The supplied application check result identifies example.flow-guarantees/v1, reports passed true, and states that the declared DAG has no structurally blocked task.","impact":"The structural portion is backed by a separately recorded checker result tied to the supplied source, contract, evidence, and requirements hashes."},{"subject":"Scope is documented","evidence":"README.md explicitly describes this as an in-process vote example and says it is not a browser, HTTP, database, external-model, or Comfy example.","impact":"This documentation reduces the risk that users interpret the narrow claim as a broader production-readiness guarantee."}],"weaknesses":[{"subject":"Modeled resources are not runtime mechanisms","evidence":"app.py contains pure arithmetic, validation, and string-rendering functions; it has no resource counters, acquisition operation, scheduler, worker pool, or atomic state transition. Contract resource production and consumption are represented in certify.py metadata and the checker model.","impact":"The resource-effect assumption is essential. If deployed runtime behavior differs from the declared effects, the structural conclusion does not describe actual execution."},{"subject":"Sequential timing workload","evidence":"certify.py executes samples serially and records observed_worker_concurrency=1 even though the contract declares summarizer concurrency 3 and renderer concurrency 2.","impact":"The claim does not establish concurrent execution safety, contention behavior, fairness, or saturation handling; users need the explicit model qualification to avoid assuming those properties."},{"subject":"Very trivial operations","evidence":"app.py operations are constant-time pure functions such as current + delta and f\"votes:{total}\", with measured durations near microseconds.","impact":"The completion evidence is valid for these exact functions but provides little predictive value for a richer vote application or future implementation with I/O, persistence, serialization, or expensive rendering."}],"improvements":[{"priority":"high","subject":"Runtime resource correspondence","recommendation":"If the application is intended to make runtime resource claims, implement or integrate the actual resource acquisition, production, consumption, and atomic state transitions, then audit those paths directly.","rationale":"The current claim passes only because the declared graph is analyzed under an assumption that its effects match runtime behavior; implementing the boundary would materially improve user-visible reliability and make the structural conclusion operationally meaningful."},{"priority":"medium","subject":"Concurrency and saturation evidence","recommendation":"Add bounded, representative concurrent tests covering renderer and summarizer worker contention, resource exhaustion, fairness, and recovery from failed tasks without changing product behavior.","rationale":"The current sequential samples cannot expose races or blocked-state behavior under the contract's declared worker capacities, so additional evidence would reduce engineering uncertainty."},{"priority":"low","subject":"Representative workload coverage","recommendation":"Retain the exact-function completion claim but add separate evidence for realistic input sizes and any future I/O or persistence paths, clearly labeling those as distinct claims.","rationale":"This preserves the narrow certificate while giving users more useful performance expectations than microsecond measurements of trivial pure functions."}],"test_fitting_risks":[{"subject":"Certificate-oriented recorder path","evidence":"certify.py only checks result is not None before recording success; it does not validate semantic output values against declared output types or a behavioral oracle.","impact":"A future function returning an incorrect but non-None value could still satisfy this completion claim, although correctness is outside the present English statement."},{"subject":"Hand-selected fixed inputs","evidence":"vote.preview and vote.commit always receive (sample_index, 1), while the other tasks receive only sample_index, and no error, boundary, or concurrent cases are measured.","impact":"The ten successful samples may not represent realistic or adverse inputs, limiting confidence if the functions later become stateful or input-sensitive."}],"evidence_gaps":[{"subject":"Actual scheduling implementation","evidence":"No scheduler or runtime resource implementation appears in the four reviewed source files; scheduling fairness and atomic acquisition are assumptions in the packet.","impact":"The audit cannot independently verify those assumptions or demonstrate that a real runtime would avoid blocked states."},{"subject":"Timing-assumption provenance","evidence":"The structural analysis relies on assumed vote.commit cadence and summary.advance and snapshot.render service envelopes, with zero measured samples for those assumed timing primitives.","impact":"The graph conclusion is conditional and may not hold when deployment cadence or service durations differ from the stated intervals."},{"subject":"Failure and state-transition paths","evidence":"The supplied completion evidence covers only successful direct calls; no exceptions, partial updates, cancellation, retries, or resource rollback paths are exercised.","impact":"Failure safety and consistency remain outside this claim and require separate testing before operational use."}],"findings":[]}
