{"audit_packet_sha256":"d15d4dbfcd310106ebd052c967a15e755a16a2f17b6330d21299ee2394ac77af","passed":true,"summary":"The claim is faithfully entailed as a conditional flow-model statement. The contract declares renderer concurrency 2, snapshot-work capacity 10 with initial level 2, vote.commit production of one unit per commit, and snapshot.render consumption of one unit. The supplied checker reports minimum modeled supply of 5 units/second, maximum modeled consumption of 4 units/second, initial work 2, and passed=true. The conclusion is conditional on the explicitly stated cadence and service-envelope assumptions, not a production-performance guarantee.","claim_reasoning":"The exact contract and checker evidence support the claimed arithmetic: a 100–200 ms commit interval yields a conservative minimum supply of 5 snapshot-work units per second, while two renderer workers with 500–1000 ms service duration yield a conservative maximum consumption rate of 4 units per second. Because supply exceeds consumption and the model starts with two units, the checker records snapshot.render as not starved after warm-up and passes the flow guarantee. certify.py wires the exact task/resource identifiers into check_flow_guarantees and verifies the resulting certificate. The conclusion is limited to the declared model and assumptions, as the English statement expressly says.","rule0_assessment":"No queue bound, timeout, retry, cancellation rule, rate limiter, rejection path, or reduced concurrency appears to have been added to force this claim to pass. The source application remains four simple in-process functions, and certify.py measures those exact functions before invoking the checker. However, the real snapshot function is only f\"votes:{total}\" and completes in roughly microseconds; the 500–1000 ms renderer occupancy is an explicit modeling assumption rather than observed runtime behavior. That is acceptable for this narrowly conditional model claim, but it must not be presented as evidence that a real renderer remains non-starved under production scheduling.","reviewed_files":["__init__.py","app.py","certify.py","README.md"],"strengths":[{"subject":"Declared renderer capacity and resource flow","evidence":"dag_contract declares renderer concurrency 2, snapshot-work capacity 10 and initial 2; vote.commit produces one snapshot-work unit and snapshot.render consumes one.","impact":"The model contains the concrete worker and resource parameters needed to calculate supply versus consumption rather than relying on an unsupported narrative assertion."},{"subject":"Conservative modeled rate comparison","evidence":"The checker result records minimum snapshot-work supply of 5.0 units/second and maximum consumption of 4.0 units/second, with passed=true and warm_start_required=2.0.","impact":"The positive rate margin supports non-starvation after warm-up across the stated cadence and service-duration bounds."},{"subject":"Explicit conditional scope","evidence":"The English requirement and README identify the 100–200 ms vote cadence and 500–1000 ms snapshot service envelope as assumptions, and README says these are modeling assumptions rather than measured production facts.","impact":"Users can distinguish the certified conditional reasoning from an unconditional runtime or infrastructure promise."},{"subject":"Checker and certificate linkage","evidence":"certify.py passes the exact task/resource IDs to check_flow_guarantees, issues the certificate, and calls verify_certificate; the packet includes matching source, contract, evidence, and requirements hashes.","impact":"The claim is tied to the supplied contract, evidence, and checker result, reducing the risk of an unrelated or stale check being cited."}],"weaknesses":[{"subject":"Unmeasured renderer occupancy","evidence":"app.py render_vote_snapshot only validates an integer and returns a short string; certify.py measures it as a microsecond-scale pure function, while the claim's 500–1000 ms occupancy is assumed.","impact":"The audit cannot infer that an actual renderer, browser, or rendering backend has this service envelope or that its workers schedule fairly under load."},{"subject":"No runtime scheduler/resource enforcement","evidence":"The application has no renderer worker pool, snapshot-work ledger, queue, admission logic, or concurrent execution path; resource effects exist in the contract and evidence metadata rather than executable application state.","impact":"The result certifies the abstract flow model only; deploying the functions without a matching scheduler could still starve, oversubscribe, or lose work."},{"subject":"Fairness and atomicity are model premises","evidence":"The structural analysis lists atomic resource acquisition and fair scheduling among assumptions, but neither app.py nor certify.py implements or tests those mechanisms.","impact":"Pathological scheduling or non-atomic resource updates are outside the certified conclusion and could invalidate a concrete runtime interpretation."}],"improvements":[{"priority":"high","subject":"Align model evidence with the promised renderer boundary","recommendation":"If this claim is intended to guide a real service, add an integration test using the actual renderer worker pool and resource accounting, measuring occupancy, concurrent workers, commit cadence, and starvation under saturation.","rationale":"The current evidence exercises only a pure string formatter; integration evidence would show that the modeled rates correspond to user-visible snapshot work and would expose scheduling or queue failures."},{"priority":"medium","subject":"Make model-versus-runtime scope prominent at consumption points","recommendation":"Keep the conditional wording in certificate/report APIs and label the renderer service envelope as assumed/model-only wherever the claim is displayed.","rationale":"This prevents a downstream reader from interpreting the passed checker result as proof of production renderer availability."},{"priority":"low","subject":"Add adversarial flow-model checks","recommendation":"Test boundary values and scheduling scenarios at 100 ms, 200 ms, 500 ms, and 1000 ms, including delayed production and concurrent resource acquisition.","rationale":"Boundary and unfair-scheduling cases would make the conditional guarantee easier to maintain and would detect arithmetic or checker regressions without changing product behavior."}],"test_fitting_risks":[{"subject":"Synthetic timing workload","evidence":"certify.py invokes each operation ten times with tiny integer/string inputs; snapshot.render is not delayed to its assumed service envelope.","impact":"Although these samples are not used to establish the assumed 500–1000 ms envelope, they could be mistakenly read as realistic renderer performance evidence."},{"subject":"Metadata-driven resource accounting","evidence":"EvidenceRecorder receives resource_produced and resource_consumed dictionaries from certify.py, while the application functions themselves do not acquire or mutate snapshot-work.","impact":"A mismatch between metadata and a future implementation could let the certificate continue to pass unless integration checks validate runtime resource effects."}],"evidence_gaps":[{"subject":"Actual two-worker execution","evidence":"The evidence records observed_worker_concurrency=1 for serial measurement and contains no concurrent renderer workload or worker-pool trace.","impact":"There is no empirical confirmation that two renderer workers can execute independently or that scheduling remains fair under concurrent demand."},{"subject":"Cadence and service-envelope observations","evidence":"The contract marks vote.commit cadence and snapshot.render service-envelope as assumed with zero required samples; no timing evidence establishes either interval or occupancy range.","impact":"The claim is valid only when operators independently ensure those assumptions hold."},{"subject":"Saturation and failure behavior","evidence":"No evidence covers resource exhaustion, delayed commits, failed renders, cancellation, retries, or queue backpressure.","impact":"The model does not establish behavior during faults or transient overload, so production non-starvation remains unproven outside the stated idealized flow."}],"findings":[]}
